{
  "$schema": "https://json-schema.org/draft/2020-12/schema",
  "$id": "memorybread.brainstorm-catalog.schema-v1",
  "type": "object",
  "additionalProperties": false,
  "required": [
    "schema_version",
    "kind",
    "catalog_id",
    "catalog_version",
    "skill_key",
    "skill_profile_sha256",
    "stages"
  ],
  "properties": {
    "schema_version": {
      "const": 1
    },
    "kind": {
      "const": "memorybread.brainstorm-catalog"
    },
    "catalog_id": {
      "type": "string",
      "pattern": "^[A-Za-z0-9][A-Za-z0-9_-]{0,63}$"
    },
    "catalog_version": {
      "type": "integer",
      "minimum": 1
    },
    "skill_key": {
      "type": "string",
      "pattern": "^[A-Za-z0-9][A-Za-z0-9_-]{0,63}$"
    },
    "skill_profile_sha256": {
      "type": "string",
      "pattern": "^[a-f0-9]{64}$"
    },
    "stages": {
      "type": "object",
      "additionalProperties": false,
      "minProperties": 1,
      "properties": {
        "direction": {
          "type": "object",
          "additionalProperties": false,
          "required": [
            "topics",
            "slots"
          ],
          "properties": {
            "topics": {
              "type": "array",
              "minItems": 1,
              "maxItems": 12,
              "uniqueItems": true,
              "items": {
                "type": "object",
                "additionalProperties": false,
                "required": [
                  "id",
                  "title",
                  "goal",
                  "root_slot_ids"
                ],
                "properties": {
                  "id": {
                    "type": "string",
                    "pattern": "^[A-Za-z0-9][A-Za-z0-9_-]{0,63}$"
                  },
                  "title": {
                    "type": "string",
                    "minLength": 1,
                    "maxLength": 60
                  },
                  "goal": {
                    "type": "string",
                    "minLength": 1,
                    "maxLength": 200
                  },
                  "root_slot_ids": {
                    "type": "array",
                    "minItems": 1,
                    "maxItems": 8,
                    "uniqueItems": true,
                    "items": {
                      "type": "string",
                      "pattern": "^[A-Za-z0-9][A-Za-z0-9_-]{0,63}$"
                    }
                  }
                }
              }
            },
            "slots": {
              "type": "array",
              "minItems": 1,
              "maxItems": 144,
              "uniqueItems": true,
              "items": {
                "type": "object",
                "additionalProperties": false,
                "required": [
                  "id",
                  "topic_id",
                  "object_id",
                  "choice_axis",
                  "required_fields",
                  "prompt_body",
                  "why_now",
                  "methods"
                ],
                "properties": {
                  "id": {
                    "type": "string",
                    "pattern": "^[A-Za-z0-9][A-Za-z0-9_-]{0,63}$"
                  },
                  "topic_id": {
                    "type": "string",
                    "pattern": "^[A-Za-z0-9][A-Za-z0-9_-]{0,63}$"
                  },
                  "object_id": {
                    "type": "string",
                    "pattern": "^[A-Za-z0-9][A-Za-z0-9_-]{0,63}$"
                  },
                  "choice_axis": {
                    "type": "string",
                    "minLength": 1,
                    "maxLength": 80
                  },
                  "required_fields": {
                    "type": "array",
                    "minItems": 1,
                    "maxItems": 32,
                    "uniqueItems": true,
                    "items": {
                      "type": "string",
                      "pattern": "^[A-Za-z0-9][A-Za-z0-9_-]{0,63}$"
                    }
                  },
                  "prompt_body": {
                    "type": "string",
                    "minLength": 1,
                    "maxLength": 60
                  },
                  "why_now": {
                    "type": "string",
                    "minLength": 1,
                    "maxLength": 80
                  },
                  "methods": {
                    "type": "array",
                    "minItems": 2,
                    "maxItems": 5,
                    "uniqueItems": true,
                    "items": {
                      "type": "object",
                      "additionalProperties": false,
                      "required": [
                        "id",
                        "object_id",
                        "required_fields",
                        "label",
                        "description",
                        "tradeoff",
                        "child_slot_ids"
                      ],
                      "properties": {
                        "id": {
                          "type": "string",
                          "pattern": "^[A-Za-z0-9][A-Za-z0-9_-]{0,63}$"
                        },
                        "object_id": {
                          "type": "string",
                          "pattern": "^[A-Za-z0-9][A-Za-z0-9_-]{0,63}$"
                        },
                        "required_fields": {
                          "type": "array",
                          "minItems": 1,
                          "maxItems": 32,
                          "uniqueItems": true,
                          "items": {
                            "type": "string",
                            "pattern": "^[A-Za-z0-9][A-Za-z0-9_-]{0,63}$"
                          }
                        },
                        "label": {
                          "type": "string",
                          "minLength": 1,
                          "maxLength": 24
                        },
                        "description": {
                          "type": "string",
                          "minLength": 1,
                          "maxLength": 80
                        },
                        "tradeoff": {
                          "type": "string",
                          "minLength": 1,
                          "maxLength": 160
                        },
                        "child_slot_ids": {
                          "type": "array",
                          "minItems": 0,
                          "maxItems": 8,
                          "uniqueItems": true,
                          "items": {
                            "type": "string",
                            "pattern": "^[A-Za-z0-9][A-Za-z0-9_-]{0,63}$"
                          }
                        }
                      }
                    }
                  }
                }
              }
            }
          }
        },
        "detail": {
          "type": "object",
          "additionalProperties": false,
          "required": [
            "topics",
            "slots"
          ],
          "properties": {
            "topics": {
              "type": "array",
              "minItems": 1,
              "maxItems": 12,
              "uniqueItems": true,
              "items": {
                "type": "object",
                "additionalProperties": false,
                "required": [
                  "id",
                  "title",
                  "goal",
                  "root_slot_ids"
                ],
                "properties": {
                  "id": {
                    "type": "string",
                    "pattern": "^[A-Za-z0-9][A-Za-z0-9_-]{0,63}$"
                  },
                  "title": {
                    "type": "string",
                    "minLength": 1,
                    "maxLength": 60
                  },
                  "goal": {
                    "type": "string",
                    "minLength": 1,
                    "maxLength": 200
                  },
                  "root_slot_ids": {
                    "type": "array",
                    "minItems": 1,
                    "maxItems": 8,
                    "uniqueItems": true,
                    "items": {
                      "type": "string",
                      "pattern": "^[A-Za-z0-9][A-Za-z0-9_-]{0,63}$"
                    }
                  }
                }
              }
            },
            "slots": {
              "type": "array",
              "minItems": 1,
              "maxItems": 144,
              "uniqueItems": true,
              "items": {
                "type": "object",
                "additionalProperties": false,
                "required": [
                  "id",
                  "topic_id",
                  "object_id",
                  "choice_axis",
                  "required_fields",
                  "prompt_body",
                  "why_now",
                  "methods"
                ],
                "properties": {
                  "id": {
                    "type": "string",
                    "pattern": "^[A-Za-z0-9][A-Za-z0-9_-]{0,63}$"
                  },
                  "topic_id": {
                    "type": "string",
                    "pattern": "^[A-Za-z0-9][A-Za-z0-9_-]{0,63}$"
                  },
                  "object_id": {
                    "type": "string",
                    "pattern": "^[A-Za-z0-9][A-Za-z0-9_-]{0,63}$"
                  },
                  "choice_axis": {
                    "type": "string",
                    "minLength": 1,
                    "maxLength": 80
                  },
                  "required_fields": {
                    "type": "array",
                    "minItems": 1,
                    "maxItems": 32,
                    "uniqueItems": true,
                    "items": {
                      "type": "string",
                      "pattern": "^[A-Za-z0-9][A-Za-z0-9_-]{0,63}$"
                    }
                  },
                  "prompt_body": {
                    "type": "string",
                    "minLength": 1,
                    "maxLength": 60
                  },
                  "why_now": {
                    "type": "string",
                    "minLength": 1,
                    "maxLength": 80
                  },
                  "methods": {
                    "type": "array",
                    "minItems": 2,
                    "maxItems": 5,
                    "uniqueItems": true,
                    "items": {
                      "type": "object",
                      "additionalProperties": false,
                      "required": [
                        "id",
                        "object_id",
                        "required_fields",
                        "label",
                        "description",
                        "tradeoff",
                        "child_slot_ids"
                      ],
                      "properties": {
                        "id": {
                          "type": "string",
                          "pattern": "^[A-Za-z0-9][A-Za-z0-9_-]{0,63}$"
                        },
                        "object_id": {
                          "type": "string",
                          "pattern": "^[A-Za-z0-9][A-Za-z0-9_-]{0,63}$"
                        },
                        "required_fields": {
                          "type": "array",
                          "minItems": 1,
                          "maxItems": 32,
                          "uniqueItems": true,
                          "items": {
                            "type": "string",
                            "pattern": "^[A-Za-z0-9][A-Za-z0-9_-]{0,63}$"
                          }
                        },
                        "label": {
                          "type": "string",
                          "minLength": 1,
                          "maxLength": 24
                        },
                        "description": {
                          "type": "string",
                          "minLength": 1,
                          "maxLength": 80
                        },
                        "tradeoff": {
                          "type": "string",
                          "minLength": 1,
                          "maxLength": 160
                        },
                        "child_slot_ids": {
                          "type": "array",
                          "minItems": 0,
                          "maxItems": 8,
                          "uniqueItems": true,
                          "items": {
                            "type": "string",
                            "pattern": "^[A-Za-z0-9][A-Za-z0-9_-]{0,63}$"
                          }
                        }
                      }
                    }
                  }
                }
              }
            }
          }
        },
        "writing": {
          "type": "object",
          "additionalProperties": false,
          "required": [
            "topics",
            "slots"
          ],
          "properties": {
            "topics": {
              "type": "array",
              "minItems": 1,
              "maxItems": 12,
              "uniqueItems": true,
              "items": {
                "type": "object",
                "additionalProperties": false,
                "required": [
                  "id",
                  "title",
                  "goal",
                  "root_slot_ids"
                ],
                "properties": {
                  "id": {
                    "type": "string",
                    "pattern": "^[A-Za-z0-9][A-Za-z0-9_-]{0,63}$"
                  },
                  "title": {
                    "type": "string",
                    "minLength": 1,
                    "maxLength": 60
                  },
                  "goal": {
                    "type": "string",
                    "minLength": 1,
                    "maxLength": 200
                  },
                  "root_slot_ids": {
                    "type": "array",
                    "minItems": 1,
                    "maxItems": 8,
                    "uniqueItems": true,
                    "items": {
                      "type": "string",
                      "pattern": "^[A-Za-z0-9][A-Za-z0-9_-]{0,63}$"
                    }
                  }
                }
              }
            },
            "slots": {
              "type": "array",
              "minItems": 1,
              "maxItems": 144,
              "uniqueItems": true,
              "items": {
                "type": "object",
                "additionalProperties": false,
                "required": [
                  "id",
                  "topic_id",
                  "object_id",
                  "choice_axis",
                  "required_fields",
                  "prompt_body",
                  "why_now",
                  "methods"
                ],
                "properties": {
                  "id": {
                    "type": "string",
                    "pattern": "^[A-Za-z0-9][A-Za-z0-9_-]{0,63}$"
                  },
                  "topic_id": {
                    "type": "string",
                    "pattern": "^[A-Za-z0-9][A-Za-z0-9_-]{0,63}$"
                  },
                  "object_id": {
                    "type": "string",
                    "pattern": "^[A-Za-z0-9][A-Za-z0-9_-]{0,63}$"
                  },
                  "choice_axis": {
                    "type": "string",
                    "minLength": 1,
                    "maxLength": 80
                  },
                  "required_fields": {
                    "type": "array",
                    "minItems": 1,
                    "maxItems": 32,
                    "uniqueItems": true,
                    "items": {
                      "type": "string",
                      "pattern": "^[A-Za-z0-9][A-Za-z0-9_-]{0,63}$"
                    }
                  },
                  "prompt_body": {
                    "type": "string",
                    "minLength": 1,
                    "maxLength": 60
                  },
                  "why_now": {
                    "type": "string",
                    "minLength": 1,
                    "maxLength": 80
                  },
                  "methods": {
                    "type": "array",
                    "minItems": 2,
                    "maxItems": 5,
                    "uniqueItems": true,
                    "items": {
                      "type": "object",
                      "additionalProperties": false,
                      "required": [
                        "id",
                        "object_id",
                        "required_fields",
                        "label",
                        "description",
                        "tradeoff",
                        "child_slot_ids"
                      ],
                      "properties": {
                        "id": {
                          "type": "string",
                          "pattern": "^[A-Za-z0-9][A-Za-z0-9_-]{0,63}$"
                        },
                        "object_id": {
                          "type": "string",
                          "pattern": "^[A-Za-z0-9][A-Za-z0-9_-]{0,63}$"
                        },
                        "required_fields": {
                          "type": "array",
                          "minItems": 1,
                          "maxItems": 32,
                          "uniqueItems": true,
                          "items": {
                            "type": "string",
                            "pattern": "^[A-Za-z0-9][A-Za-z0-9_-]{0,63}$"
                          }
                        },
                        "label": {
                          "type": "string",
                          "minLength": 1,
                          "maxLength": 24
                        },
                        "description": {
                          "type": "string",
                          "minLength": 1,
                          "maxLength": 80
                        },
                        "tradeoff": {
                          "type": "string",
                          "minLength": 1,
                          "maxLength": 160
                        },
                        "child_slot_ids": {
                          "type": "array",
                          "minItems": 0,
                          "maxItems": 8,
                          "uniqueItems": true,
                          "items": {
                            "type": "string",
                            "pattern": "^[A-Za-z0-9][A-Za-z0-9_-]{0,63}$"
                          }
                        }
                      }
                    }
                  }
                }
              }
            }
          }
        }
      }
    }
  }
}
