{
  "schema_version": 1,
  "kind": "memorybread.brainstorm-catalog",
  "catalog_id": "gpu-cost-weekly-report-detail",
  "catalog_version": 1,
  "skill_key": "creation-skill-gpu-cost-weekly-report",
  "skill_profile_sha256": "e786d6d344712e016b861b1447a414d7030a10a9d7254de4e31bdffcc586e508",
  "stages": {
    "detail": {
      "topics": [
        {
          "id": "detail-field-mapping",
          "title": "核心数据指标提取与清洗",
          "goal": "组织原始指标表的字段对照记录，便于核对来源字段与表内位置",
          "root_slot_ids": [
            "field-map-organize"
          ]
        },
        {
          "id": "detail-cost-evidence",
          "title": "成本收益量化分析",
          "goal": "组织既定成本项目表的原值来源与解释证据，便于核验既定排序与指标",
          "root_slot_ids": [
            "cost-evidence-organize"
          ]
        },
        {
          "id": "detail-chart-notes",
          "title": "可视化图表生成",
          "goal": "安排既定图表的图例、图注及来源说明位置，保持图表口径与数据值",
          "root_slot_ids": [
            "chart-notes-position"
          ]
        },
        {
          "id": "detail-risk-evidence",
          "title": "风险预警与瓶颈分析",
          "goal": "在既定独立风险板块组织证据记录与条目索引，便于核验风险描述",
          "root_slot_ids": [
            "risk-evidence-archive"
          ]
        },
        {
          "id": "detail-summary-index",
          "title": "报告结论与决策建议",
          "goal": "组织结论与建议的证据索引，使管理层可逐项核对依据与限制",
          "root_slot_ids": [
            "summary-index-organize"
          ]
        }
      ],
      "slots": [
        {
          "id": "field-map-organize",
          "topic_id": "detail-field-mapping",
          "object_id": "field-correspondence-records",
          "choice_axis": "字段对照记录的组织位置",
          "required_fields": [
            "source_name",
            "source_field_label",
            "source_locator",
            "target_table",
            "target_column",
            "source_period",
            "captured_at"
          ],
          "prompt_body": "字段对照记录怎样组织，便于核对来源原列与表内位置？",
          "why_now": "确定对照记录的组织方式，便于核验原始字段与来源。",
          "methods": [
            {
              "id": "field-map-organize-list",
              "label": "集中字段对照清单",
              "description": "用独立清单列出完整字段对照及来源时间信息，原指标表保留原列与原值。",
              "tradeoff": "便于整体核对，阅读原表时需对照清单。",
              "child_slot_ids": [
                "field-map-list-entry"
              ],
              "object_id": "field-correspondence-records",
              "required_fields": [
                "source_name",
                "source_field_label",
                "source_locator",
                "target_table",
                "target_column",
                "source_period",
                "captured_at"
              ]
            },
            {
              "id": "field-map-organize-notes",
              "label": "随表字段对照注",
              "description": "在各原指标表下列出同样完整的字段对照及来源时间信息，原表保持原样。",
              "tradeoff": "便于就近核对，多张表需分别维护对照注。",
              "child_slot_ids": [
                "field-map-note-entry"
              ],
              "object_id": "field-correspondence-records",
              "required_fields": [
                "source_name",
                "source_field_label",
                "source_locator",
                "target_table",
                "target_column",
                "source_period",
                "captured_at"
              ]
            }
          ]
        },
        {
          "id": "field-map-list-entry",
          "topic_id": "detail-field-mapping",
          "object_id": "field-correspondence-list-entry",
          "choice_axis": "集中清单内定位信息的呈现位置",
          "required_fields": [
            "source_name",
            "source_field_label",
            "source_locator",
            "target_table",
            "target_column",
            "source_period",
            "captured_at"
          ],
          "prompt_body": "集中字段对照清单的定位信息放在哪里？",
          "why_now": "为清单条目确定可核对的定位信息位置。",
          "methods": [
            {
              "id": "field-map-list-entry-inline",
              "label": "定位信息列内展开",
              "description": "在清单条目内展开来源字段、来源定位、目标表列及来源时间信息。",
              "tradeoff": "每条信息完整可见，清单较宽。",
              "child_slot_ids": [],
              "object_id": "field-correspondence-list-entry",
              "required_fields": [
                "source_name",
                "source_field_label",
                "source_locator",
                "target_table",
                "target_column",
                "source_period",
                "captured_at"
              ]
            },
            {
              "id": "field-map-list-entry-attached",
              "label": "定位信息随项附注",
              "description": "清单条目附注列出同样完整的字段、来源定位、目标表列及来源时间信息。",
              "tradeoff": "清单较紧凑，核对时需阅读条目附注。",
              "child_slot_ids": [],
              "object_id": "field-correspondence-list-entry",
              "required_fields": [
                "source_name",
                "source_field_label",
                "source_locator",
                "target_table",
                "target_column",
                "source_period",
                "captured_at"
              ]
            }
          ]
        },
        {
          "id": "field-map-note-entry",
          "topic_id": "detail-field-mapping",
          "object_id": "field-correspondence-table-note",
          "choice_axis": "随表对照注的对应信息顺序",
          "required_fields": [
            "source_name",
            "source_field_label",
            "source_locator",
            "target_table",
            "target_column",
            "source_period",
            "captured_at"
          ],
          "prompt_body": "随表字段对照注的来源与目标怎样排列？",
          "why_now": "为表下注释中的字段对应关系确定阅读顺序。",
          "methods": [
            {
              "id": "field-map-note-entry-source-first",
              "label": "来源字段先行",
              "description": "每项先列来源字段与定位，再列目标表列和来源时间信息，保留完整对照。",
              "tradeoff": "便于从原字段核对目标位置。",
              "child_slot_ids": [],
              "object_id": "field-correspondence-table-note",
              "required_fields": [
                "source_name",
                "source_field_label",
                "source_locator",
                "target_table",
                "target_column",
                "source_period",
                "captured_at"
              ]
            },
            {
              "id": "field-map-note-entry-target-first",
              "label": "目标位置先行",
              "description": "每项先列目标表列，再列来源字段、定位和来源时间信息，保留完整对照。",
              "tradeoff": "便于从表内位置追溯原字段。",
              "child_slot_ids": [],
              "object_id": "field-correspondence-table-note",
              "required_fields": [
                "source_name",
                "source_field_label",
                "source_locator",
                "target_table",
                "target_column",
                "source_period",
                "captured_at"
              ]
            }
          ]
        },
        {
          "id": "cost-evidence-organize",
          "topic_id": "detail-cost-evidence",
          "object_id": "cost-value-evidence-records",
          "choice_axis": "原值来源与解释证据的放置方式",
          "required_fields": [
            "project_name",
            "original_metric_name",
            "original_metric_value",
            "original_row_locator",
            "source_period",
            "captured_at",
            "explanation_reference"
          ],
          "prompt_body": "原成本表的取值来源与解释证据，放在哪里便于核对？",
          "why_now": "确定证据组织位置，保持原表取值与行列关系可核验。",
          "methods": [
            {
              "id": "cost-evidence-organize-row-notes",
              "label": "表后逐行证据解读",
              "description": "原成本表保留原列与原序，表后逐行列出项目、原指标值、原行定位、来源时间及解释依据。",
              "tradeoff": "便于逐行阅读，表后说明较长。",
              "child_slot_ids": [
                "cost-evidence-row-note"
              ],
              "object_id": "cost-value-evidence-records",
              "required_fields": [
                "project_name",
                "original_metric_name",
                "original_metric_value",
                "original_row_locator",
                "source_period",
                "captured_at",
                "explanation_reference"
              ]
            },
            {
              "id": "cost-evidence-organize-register",
              "label": "附表集中证据清单",
              "description": "原成本表保留原列与原序，附表清单列出同样完整的项目、原值、定位、来源时间及解释依据。",
              "tradeoff": "原表阅读较简洁，核对时需查看证据清单。",
              "child_slot_ids": [
                "cost-evidence-register"
              ],
              "object_id": "cost-value-evidence-records",
              "required_fields": [
                "project_name",
                "original_metric_name",
                "original_metric_value",
                "original_row_locator",
                "source_period",
                "captured_at",
                "explanation_reference"
              ]
            }
          ]
        },
        {
          "id": "cost-evidence-row-note",
          "topic_id": "detail-cost-evidence",
          "object_id": "cost-evidence-row-explanation",
          "choice_axis": "逐行解读中原行定位的放置位置",
          "required_fields": [
            "project_name",
            "original_metric_name",
            "original_metric_value",
            "original_row_locator",
            "source_period",
            "captured_at",
            "explanation_reference"
          ],
          "prompt_body": "表后逐行证据解读的原行定位放在哪里？",
          "why_now": "使每项说明与对应原表行保持明确连接。",
          "methods": [
            {
              "id": "cost-evidence-row-note-lead",
              "label": "原行定位放开头",
              "description": "每项说明先列项目与原行定位，再列原指标值、来源时间和解释依据。",
              "tradeoff": "阅读前即可定位原表，说明开头信息较多。",
              "child_slot_ids": [],
              "object_id": "cost-evidence-row-explanation",
              "required_fields": [
                "project_name",
                "original_metric_name",
                "original_metric_value",